{
  "$schema": "https://json-schema.org/draft/2020-12/schema",
  "$id": "https://todero.dev/schemas/prp/v1/fixture.schema.json",
  "title": "PRP scripted replay fixture",
  "type": "object",
  "required": [
    "schema",
    "fixtureVersion",
    "protocolVersion",
    "name",
    "description",
    "identity",
    "capabilities",
    "commands",
    "events",
    "result"
  ],
  "properties": {
    "schema": { "const": "todero.prp.fixture.v1" },
    "fixtureVersion": { "const": 1 },
    "protocolVersion": { "const": 1 },
    "name": { "type": "string", "minLength": 1, "maxLength": 120 },
    "description": { "type": "string", "minLength": 1, "maxLength": 1000 },
    "identity": { "$ref": "https://todero.dev/schemas/prp/v1/identity.schema.json" },
    "capabilities": { "$ref": "https://todero.dev/schemas/prp/v1/capabilities.schema.json" },
    "commands": {
      "type": "array",
      "items": { "$ref": "https://todero.dev/schemas/prp/v1/command.schema.json" }
    },
    "events": {
      "type": "array",
      "minItems": 1,
      "items": { "$ref": "https://todero.dev/schemas/prp/v1/event.schema.json" }
    },
    "requests": {
      "type": "array",
      "items": { "$ref": "https://todero.dev/schemas/prp/v1/request.schema.json" }
    },
    "result": { "$ref": "https://todero.dev/schemas/prp/v1/result.schema.json" }
  },
  "additionalProperties": true
}
